{"schema_version": 1, "kind": "quality_disposition_review", "draft": {"schema_version": 1, "kind": "quality_disposition_draft", "id": "local_clang_tidy_correction", "requested_kind": "correction", "origin_digest": "bb8bd1270e3191aee8a0a5a4d9b62d7b55bd488f305030efe53b1f1d7c81e8a8", "finding_index": 1, "construct": {"kind": "file", "path": "check.cpp", "sha256": "ac0dc48de1665741748f2f6473c00e9945534c03576b0d283f2c13c8e618451e"}, "scope": {"component": "seeded_quality_probe", "translation_units": ["check.cpp"]}, "native_category": null, "rationale": "Synthetic defect/fix example for independent human review; no approval claimed", "impact": {"safety": "Pending engineering review", "security": "Pending engineering review"}, "alternatives": ["Remove unsafe construct"], "compensating_evidence": [], "expires_at": null, "review_triggers": ["Source, scope, tool or policy change"], "native_metadata": {"fixture_source": true}, "decision_refs": [], "digest": "8c1ce7e09845f708c2bc6cf432bb90dbfefa9916b569c948a2750b3b2f129391"}, "subject": {"origin_ref": {"path": "/home/jefferson/s-core_sw_fabric/specs/010-misra-quality-and-deviations/evidence/disposition-clang-tidy-origin-run.json", "sha256": "6b6ff225bf97ceba66f5f6ed0db36cd967ccc469a05ce6f5a14e06224a0da381"}, "origin_digest": "bb8bd1270e3191aee8a0a5a4d9b62d7b55bd488f305030efe53b1f1d7c81e8a8", "origin_class": "local_unprotected_execution", "finding_index": 1, "finding": {"native_id": "clang-analyzer-core.NullDereference", "native_level": "Error", "artifact_id": "diagnostics-0", "result_index": 1, "locations": [{"path": "check.cpp", "byte_offset": 117, "message": "Dereference of null pointer (loaded from variable 'value')"}, {"path": "check.cpp", "byte_offset": 84, "message": "'value' initialized to a null pointer value"}, {"path": "check.cpp", "byte_offset": 117, "message": "Dereference of null pointer (loaded from variable 'value')"}], "native_record": {"DiagnosticName": "clang-analyzer-core.NullDereference", "DiagnosticMessage": {"Message": "Dereference of null pointer (loaded from variable 'value')", "FilePath": "/tmp/score-quality-v6_ri7a8/source/check.cpp", "FileOffset": 117, "Replacements": [], "Ranges": [{"FilePath": "/tmp/score-quality-v6_ri7a8/source/check.cpp", "FileOffset": 118, "Length": 5}]}, "Notes": [{"Message": "'value' initialized to a null pointer value", "FilePath": "/tmp/score-quality-v6_ri7a8/source/check.cpp", "FileOffset": 84, "Replacements": [], "Ranges": [{"FilePath": "/tmp/score-quality-v6_ri7a8/source/check.cpp", "FileOffset": 84, "Length": 10}]}, {"Message": "Dereference of null pointer (loaded from variable 'value')", "FilePath": "/tmp/score-quality-v6_ri7a8/source/check.cpp", "FileOffset": 117, "Replacements": [], "Ranges": [{"FilePath": "/tmp/score-quality-v6_ri7a8/source/check.cpp", "FileOffset": 118, "Length": 5}]}], "Level": "Error", "BuildDirectory": "/tmp/score-quality-v6_ri7a8"}}, "baseline": {"component": "seeded_quality_probe", "files": [{"path": "check.cpp", "sha256": "ac0dc48de1665741748f2f6473c00e9945534c03576b0d283f2c13c8e618451e"}], "translation_units": ["check.cpp"], "expected_units": ["check.cpp"], "include_dirs": [], "defines": [], "language": "c++17", "source_digest": "7b5e99959f2f71f928300929ec8b08be69188e9e5c01fbc9ba4ad2a3bd4dd738", "profile": {"path": "/home/jefferson/s-core_sw_fabric/profiles/s-core-quality-v1.yaml", "sha256": "720a64d14ecc193e034a45e3c68dffed27df1d23837b886268af55acd1413ec9"}, "toolchain": {"path": "/home/jefferson/s-core_sw_fabric/profiles/cpp17-quality-local-v1.yaml", "sha256": "db130de6ac21b10752cd2ea6594cc5927d7a900ef6ffb3ce342eb5826dde444f"}, "configuration": {"path": "/home/jefferson/s-core_sw_fabric/profiles/native-quality/clang-tidy.yaml", "sha256": "fe06da767c62270a410d08bd07cdfc13cf2e1c01c0cd31fb15ac37c515f19901"}, "full_digest": "07219d8e540b86e88345ecb50224d3ee51d840d1afff2069f8e574a7e97f1260"}, "digest": "4146e60d2f32f39ef9c7f1795d38a3593c225e2031f0ca70f412ed751402a2b9"}, "current_baseline": {"component": "seeded_quality_probe", "files": [{"path": "check.cpp", "sha256": "ac0dc48de1665741748f2f6473c00e9945534c03576b0d283f2c13c8e618451e"}], "translation_units": ["check.cpp"], "expected_units": ["check.cpp"], "include_dirs": [], "defines": [], "language": "c++17", "source_digest": "7b5e99959f2f71f928300929ec8b08be69188e9e5c01fbc9ba4ad2a3bd4dd738", "profile": {"path": "/home/jefferson/s-core_sw_fabric/profiles/s-core-quality-v1.yaml", "sha256": "720a64d14ecc193e034a45e3c68dffed27df1d23837b886268af55acd1413ec9"}, "toolchain": {"path": "/home/jefferson/s-core_sw_fabric/profiles/cpp17-quality-local-v1.yaml", "sha256": "db130de6ac21b10752cd2ea6594cc5927d7a900ef6ffb3ce342eb5826dde444f"}, "configuration": {"path": "/home/jefferson/s-core_sw_fabric/profiles/native-quality/clang-tidy.yaml", "sha256": "fe06da767c62270a410d08bd07cdfc13cf2e1c01c0cd31fb15ac37c515f19901"}, "full_digest": "07219d8e540b86e88345ecb50224d3ee51d840d1afff2069f8e574a7e97f1260"}, "fresh_run": null, "previous": null, "revision": 1, "observed_at": "2026-09-30T17:43:54.154496+00:00", "time_basis": "local_untrusted", "state": "open", "reasons": ["FRESH_ANALYSIS_REQUIRED"], "outcome": "unresolved", "origin": "local_unprotected_execution", "assurance_eligibility": "not_eligible", "engineering_readiness": "not_evaluated", "limitations": ["Proposals, native metadata, category and previous states are unauthenticated.", "Historical origin labels and seals cannot authenticate earlier execution.", "Whole-file scope; matching checks anywhere in the component remain open.", "Fresh execution is local and unprotected; mapping and acceptance remain pending.", "005 decision replay and protected production authority remain unavailable."], "digest": "644acfd1e8cd36674fff3605e0bb27c130130fba689f865a93f668430853de94"}